{
  "$schema": "https://json-schema.org/draft/2020-12/schema",
  "$id": "https://flowguard.dev/schemas/inventory-0.1.json",
  "title": "FlowGuard obligation manifest",
  "description": "The merged inventory a verdict is computed against. independent_of_agent is carried, but the verifier recomputes it from the source kinds: a manifest that asserts its own independence is not evidence of independence.",
  "type": "object",
  "required": ["manifest_version", "target_lock", "sources", "paths", "independent_of_agent"],
  "additionalProperties": false,
  "properties": {
    "manifest_version": { "enum": ["inventory/0.1"] },
    "target_lock": { "type": "string", "minLength": 1 },
    "target_lock_conflict": { "type": "array", "items": { "type": "string" } },
    "sources": {
      "type": "array",
      "minItems": 1,
      "items": {
        "type": "object",
        "required": ["source_id", "kind"],
        "properties": {
          "source_id": { "type": "string" },
          "kind": { "enum": ["grants", "static", "routes", "runtime", "agent", "manual"] },
          "covers": { "type": "array", "items": { "type": "string" } },
          "blind_spots": { "type": "array", "items": { "type": "string" } }
        }
      }
    },
    "paths": {
      "type": "array",
      "items": {
        "type": "object",
        "required": ["path_id", "entry", "kind"],
        "properties": {
          "path_id": { "type": "string", "minLength": 4 },
          "entry": { "type": "string", "minLength": 3 },
          "kind": { "type": "string" },
          "control_point": { "type": "string" },
          "confidence": { "type": "string" },
          "detail": { "type": "string" },
          "calls": { "type": "array", "items": { "type": "string" } },
          "found_by": { "type": "array", "items": { "type": "string" } },
          "kinds": { "type": "array", "items": { "type": "string" } },
          "attribution": {
            "type": "object",
            "required": ["to", "method"],
            "properties": {
              "to": { "type": "string" },
              "method": { "enum": ["direct", "transitive"] },
              "confidence": { "type": "string" },
              "sources": { "type": "array", "items": { "type": "string" } }
            }
          },
          "vanished": { "type": "boolean" }
        }
      }
    },
    "independent_of_agent": { "type": "boolean" },
    "conflicts": { "type": "array", "items": { "type": "object" } },
    "delta_since_previous": {
      "type": "object",
      "required": ["new_paths", "vanished_paths", "net_change", "published"],
      "properties": {
        "new_paths": { "type": "integer", "minimum": 0 },
        "vanished_paths": { "type": "integer", "minimum": 0 },
        "net_change": { "type": "integer" },
        "published": { "type": "boolean" }
      }
    },
    "perimeter_growth": { "type": "boolean" },
    "paths_total": { "type": "integer", "minimum": 0 },
    "in_core_attributed": { "type": "integer", "minimum": 0 }
  }
}
